Catálogo de secciones actualizado Septiembre 2022.,"Se actualizó el catálogo de secciones al corte de Septiembre del 2022, por lo que es necesario actualizar todos los activos analíticos que se alimenten de este dato.",https://trello.com/c/RctHkm3q,2022-10-05 16:57:02,Done,62f517c88139162f95eca4f1,2022-10-11 16:43:01,Adilene Anaid Rodriguez Uriarte,adileneanaidrodriguezuriarte,GCIA RRHH,0.681076388888889,97.12892361111112,5.19693287037037,8.101851851851852e-05,0.006238425925925925,0.10592592592592592,RctHkm3q
ID l2FBxS4g - Solicitud de informe de planta de Prevención Regional,"Replicar reporte ""Informe de Planta Mantenimiento Regional"" con información de la sección 110 Prevención Regional, dudas 6677843808",https://trello.com/c/l2FBxS4g,2022-10-07 09:27:13,Done,62febe991aad95360613c4a1,2022-10-13 08:27:55,Frederick Angulo Velazquez,frederick_angulo,GCIA RRHH,3.3948495370370364,95.47274305555555,1.6647222222222222,5.7870370370370366e-05,0.8991782407407407,,l2FBxS4g
ID RtZFzkZS - 36368.1 - Caminando Juntos (Segmentación de listados por período de 6 meses),,https://trello.com/c/RtZFzkZS,2022-10-10 12:47:10,Done,5a384ee5d3e6d3977fb436e7,2022-10-18 17:29:28,Carolina Amarillas,carolinaamarillas,GCIA RRHH,,90.09667824074074,5.980451388888889,,0.0034606481481481485,2.21212962962963,RtZFzkZS
Tablero Temático Recursos Humanos - Re Diseño,"Cambiar la vista de todo el tablero y unificar el diseño a tablero temático 
",https://trello.com/c/Pti6L1WI,2022-10-10 15:46:26,Done,5a384ee5d3e6d3977fb436e7,2022-10-19 08:01:09,Carolina Amarillas,carolinaamarillas,GCIA RRHH,0.0034027777777777784,89.4913425925926,6.8684259259259255,0.00011574074074074073,4.6296296296296294e-05,1.8048958333333334,Pti6L1WI
Tablero Temático Recursos Humanos - Vista de planta,,https://trello.com/c/YVeglHNE,2022-10-12 11:10:42,Done,5a384ee5d3e6d3977fb436e7,2022-10-26 09:29:02,Carolina Amarillas,carolinaamarillas,GCIA RRHH,0.0004398148148148148,82.4303125,1.9016666666666666,0.0006828703703703703,0.0017592592592592592,12.024849537037037,YVeglHNE
Tablero Temático Recursos Humanos - Vista TDC,,https://trello.com/c/ShRrXgTK,2022-10-12 11:13:01,Done,5a384ee5d3e6d3977fb436e7,2022-10-26 09:29:04,Carolina Amarillas,carolinaamarillas,GCIA RRHH,4.6296296296296294e-05,82.43028935185185,1.9016435185185185,0.00032407407407407406,0.0009837962962962964,12.024814814814816,ShRrXgTK
Automatizar Soluciones de Crédito BanCoppel (Mensual) 1/2,"Construcción de indicadores del Tablero de Servicios Financieros con información del DWH: Soluciones de Crédito BanCoppel

Plan de Automatización (incluye enlace y lógica del indicador)
https://docs.google.com/spreadsheets/d/19HPJbh3iHYhzd-QDSEBRxTOERzbL3aLunEl6_lMiTSY/edit#gid=0",https://trello.com/c/pnlYuGIO,2022-08-08 11:40:43,Done,6215385da0392b293ab543d6,2022-10-24 08:02:05,Rosario García Félix,rosariogarciafelix,GCIA Tablero de Control,,49.58592592592593,9.54670138888889,2.280497685185185,36.64032407407407,19.300057870370374,pnlYuGIO
Nuevo diseño vista presentación / explorer conforme a las observaciones del Sr Agustín Coppel,"Se modificará la vista presentación y explorer del Tablero de Control conforme a las observaciones del sr. Agustín.

1.- Cambiar el fondo gris a blanco  de las comunas de compromiso en el mensual y acumulado.
2.- Cambiar la presentación del % de cumplimiento del compromiso  en mensual y acumulado. Ejemplo : Si el indicador tenia un  cumplimiento del compromiso del  105.3% , va a cambiar a 5.3%. En cambio si es por debajo del 100% , Ejemplo: 95.5% va cambiar a - 4.5%.
3.- Colocar focos de colores ( verde y rojo ) por indicador conforme al cumplimiento del compromiso.


Documento de diseño de vista explorer y presentación

https://docs.google.com/spreadsheets/d/1P4wzlhbe62dZkVV7Y6I1GPk9my93lZdYOwIdlwwFz90/edit?usp=sharing",https://trello.com/c/1Ol6iXKm,2022-08-09 10:47:11,Done,6242583145f70208770f6068,2022-10-17 08:01:40,Paúl Enrique Cabrera López,enriquecabrera01,GCIA Tablero de Control,28.20027777777778,91.49089120370371,6.699675925925926,,21.9358912037037,12.049212962962963,1Ol6iXKm
Desarrollar Vista Explorer en el tablero grupo Coppel,Desarrollo de vista Explorer de Tablero Grupo Coppel 2.2,https://trello.com/c/ugsIBW68,2022-08-15 11:15:19,Done,5a384dc645d16593e8ad46cf,2022-10-05 08:01:41,Jesús David Aranguré Morales,davidarangure,GCIA Tablero de Control,0.001423611111111111,103.49089120370371,6.93324074074074,6.964976851851852,14.300416666666665,22.66547453703704,ugsIBW68
Automatizar Afore Coppel (Mensual),"Generar  el indicador KPIC3903 Ingreso Afore Coppel con información del DWH para Tablero de Servicios Financiero (Automatizar)
Lógica: Son los ingresos por comisiones Afore.
La información de manera manual para el TSF la comparte Victor Eduardo Larranaga Ramirez.

Plan de Automatización (incluye enlace y lógica del indicador)
https://docs.google.com/spreadsheets/d/19HPJbh3iHYhzd-QDSEBRxTOERzbL3aLunEl6_lMiTSY/edit#gid=0
",https://trello.com/c/9Y9S3kv3,2022-08-15 15:54:36,Done,6215385da0392b293ab543d6,2022-10-24 17:03:43,Rosario García Félix,rosariogarciafelix,GCIA Tablero de Control,,84.11447916666667,6.286516203703704,5.012777777777777,4.039583333333334,17.888796296296295,9Y9S3kv3
Integrar Nuevos Indicadores Muebles - Fase 2 (119),"Se acercó el equipo de Función Muebles para platicar la necesidad que tiene Diego Coppel buscando integrarlos en el tablero comercial. 

448 Indicadores dados de alta al 3 Junio.",https://trello.com/c/N6GfGgg2,2022-09-07 10:58:28,Done,617708e18a47983dab130870,2022-10-03 09:55:25,jesus paul rodriguez benitez,jesuspaulrodriguezbenitez,GCIA Tablero de Control,,105.41194444444444,2.9722222222222223,,12.098946759259258,10.885046296296297,N6GfGgg2
Agregar cálculos de Inflación en Tablero Omnicanal.,Se agregarán cálculos de inflación al modelo Omnicanal. Para esto se actualizará el extracto actual y se agregará un botón / switch en donde se podrá cambiar el dato para verlo con o sin inflación.,https://trello.com/c/SHArTdk7,2022-09-09 10:54:08,Done,622a9cc39010e04ccc16f273,2022-10-04 16:23:56,Monica Nohely Castro Lugo,monicanohelycastrolugo,GCIA Tablero de Control,3.197118055555556,104.1421412037037,10.996493055555558,,,11.035416666666666,SHArTdk7
Migración Tablero Diario Grupo Coppel v3.0 - Menú y Panel Izquierdo,"Desarrollo de menú principal, area de títulos y panel izquierdo de indicadores",https://trello.com/c/88fNOtXw,2022-09-21 15:59:25,Done,5a384dc645d16593e8ad46cf,2022-10-12 09:56:33,Jesús David Aranguré Morales,davidarangure,GCIA Tablero de Control,0.9555092592592592,96.41116898148148,2.0021064814814813,0.007187499999999999,4.776018518518518,13.007187499999999,88fNOtXw
Migración Tablero Diario Grupo Coppel v3.0- Panel Derecho(Parte 1),Desarrollo de Panel superior derecho y gráfico Histórico.,https://trello.com/c/Y6MUxIpw,2022-09-21 16:04:29,Done,5a384dc645d16593e8ad46cf,2022-10-28 16:22:15,Jesús David Aranguré Morales,davidarangure,GCIA Tablero de Control,0.9555092592592592,80.14332175925925,4.229606481481482,0.0037037037037037043,17.823275462962965,14.000243055555556,Y6MUxIpw
Automatizar 4 Kpis Ecommerce (Ventas) 9 Octubre,,https://trello.com/c/8FDFNTnG,2022-09-23 12:03:55,Done,617708e18a47983dab130870,2022-10-07 12:38:07,jesus paul rodriguez benitez,jesuspaulrodriguezbenitez,GCIA Tablero de Control,2.8883564814814817,101.29896990740741,0.04607638888888888,2.167777777777778,1.9562037037037037,6.965335648148148,8FDFNTnG
Automatizar Kpis (Nivel de Servicio) 7 Octubre - Ecommerce,,https://trello.com/c/4qn89NXl,2022-09-23 12:07:59,Done,617708e18a47983dab130870,2022-10-12 18:14:51,jesus paul rodriguez benitez,jesuspaulrodriguezbenitez,GCIA Tablero de Control,2.8850231481481483,96.0651273148148,2.2905555555555557,2.1679629629629633,1.9588078703703704,9.952407407407408,4qn89NXl
Automatizar 8 Indicadores al corte de Agosto - Ecommerce,,https://trello.com/c/a5ymbSsC,2022-09-23 18:14:46,Done,617708e18a47983dab130870,2022-10-03 15:44:49,jesus paul rodriguez benitez,jesuspaulrodriguezbenitez,GCIA Tablero de Control,2.623761574074074,105.16931712962963,0.25501157407407404,2.1715625,1.9580671296296297,2.887465277777778,a5ymbSsC
"Propuesta Nueva Sección Eficiencia y Productividad , 1/3 José Juan","Conforme al desarrollo del TGC, se solicita la creación de los siguientes indicadores:

Documento Propuesta:

[https://docs.google.com/spreadsheets/d/1I4l6sppPjKW_Anr4cwvucNyKfC6QuMEpFKUNvDtgsNY/edit#gid=0](https://docs.google.com/spreadsheets/d/1I4l6sppPjKW_Anr4cwvucNyKfC6QuMEpFKUNvDtgsNY/edit#gid=0 ""smartCard-inline"")",https://trello.com/c/VwyYKE6G,2022-09-28 14:47:09,Done,615f7881e7055586c22cb732,2022-10-25 08:02:21,José Juan,jose_juan_herrera,GCIA Tablero de Control,,83.49048611111111,6.557268518518519,0.8040509259259259,1.0894907407407406,18.268078703703704,VwyYKE6G
Automatizar Ingresos Mensual (Diego Cruz) 3/3_1,"Esta ficha se deriva de la tarjeta llamada _**Automatizar Ingresos (Mensual)**_
de acuerdo a las temáticas de @diegocruzterrones ",https://trello.com/c/xwVpLoES,2022-10-17 11:25:51,Done,6215385da0392b293ab543d6,2022-10-24 08:02:04,Rosario García Félix,rosariogarciafelix,GCIA Tablero de Control,,84.49071759259259,6.69650462962963,,,0.16196759259259258,xwVpLoES
34116 - Reporte de indicadores CDC,"Actualmente se está concentrando mercancía Nacional e Importación de Muebles, en Cedis Importación y Nacionales bajo la lógica del CDC (Cedis Dosificador Concentrador) y una forma de monitorear el comportamiento de los códigos que están dentro de esta lógica y el beneficio que este proyecto está reflejando a corto y largo plazo, es mediante la generación de un reporte de indicadores que se le compartiría al área comercial

Se necesita un reporte con la información de 4 indicadores a nivel SKU-Cedis y al corte de mes, los cuales son existencias, ventas, traspasos y agotado de las regiones.
",https://trello.com/c/hymfuyTL,2022-08-05 16:45:56,Done,5a384ee5d3e6d3977fb436e7,2022-10-17 10:19:46,Carolina Amarillas,carolinaamarillas,GCIA Cadena de Suministro,57.58540509259259,91.39498842592592,,15.120775462962964,0.005046296296296296,0.020601851851851854,hymfuyTL
29353 - Informe de traspasos Sistema Inventario Tecnología,"Se requiere un informe mensual de los traspasos de los artículos de centros del sistema de inventario tecnología, de los almacenes hacia centros. En formato editable, ya que de esta información se realizaran diferentes análisis.",https://trello.com/c/F82kImwp,2022-08-22 18:09:24,Done,5b8d8b1accaad285f03e3b73,2022-10-17 15:32:58,José Carlos Zenteno Félix,josecarloszentenofelix,GCIA Cadena de Suministro,40.929467592592594,91.17751157407407,,14.934594907407407,0.0005555555555555556,0.026747685185185183,F82kImwp
Actualizar Gastos Vs Unidades Leídas del Picking con la lógica del nuevo sistema de contabilidad,"Actualizar Costo por Surtir 10,000 Unidades - Frontera con la lógica del nuevo sistema de contabilidad",https://trello.com/c/ndgegC9j,2022-08-26 11:40:21,Done,5b8d8b1accaad285f03e3b73,2022-10-10 11:12:46,José Carlos Zenteno Félix,josecarloszentenofelix,GCIA Cadena de Suministro,5.328726851851852,98.35820601851852,,22.618020833333333,0.000775462962962963,17.03332175925926,ndgegC9j
Reporte de sobrantes y faltantes en cedis regionales ropa y muebles,"Se requiere un reporte de los indicadores de faltantes y sobrantes que muestra la Evaluación Objetiva de las secciones de cedis productiva (Loteo, Rack, Piso) y cedis ropa (Colgado, Doblado, Zapatería y Picking) con la información concentrada de todos los cedis con una periodicidad mensual.",https://trello.com/c/6nPNA4fA,2022-09-21 15:58:51,Done,5b8d8b1accaad285f03e3b73,2022-10-06 15:47:37,José Carlos Zenteno Félix,josecarloszentenofelix,GCIA Cadena de Suministro,,98.3590162037037,0.00032407407407407406,1.7886805555555554,,17.011550925925924,6nPNA4fA
37079.1 - APAGADO DE INDICADORES ZAPATO (SECCIÓN Y PICKING CEDIS HLLO),"
Descripción de la petición

Se solicita que la evaluación objetiva, Indicadores evaluativos y complementarios de los centros 215901 y 215906 sean apagados de manera temporal en los meses de octubre, noviembre y diciembre 2022 debido a por temas de capacidad actual de Cedis y las proyecciones que se tienen para la temporada, se tomó la decisión de no enviar el zapato a HLLO en este año, retomando las actividades en el 2023.",https://trello.com/c/PyDZq39p,2022-09-23 15:58:38,Done,5a384ee5d3e6d3977fb436e7,2022-10-10 11:17:31,Carolina Amarillas,carolinaamarillas,GCIA Cadena de Suministro,16.804780092592594,98.35494212962963,,,,,PyDZq39p
Ajuste centralizador responsable Evaluación Objetiva Distribución,Se solicitó cambiar el centralizador responsable de la sección de distribución crossdocking a Marco Antonio Ahumada en la Evaluación Objetiva.,https://trello.com/c/SWCidjsr,2022-10-03 11:51:21,Done,5b8d8b1accaad285f03e3b73,2022-10-03 11:55:27,José Carlos Zenteno Félix,josecarloszentenofelix,GCIA Cadena de Suministro,,105.32861111111112,,,,0.002847222222222222,SWCidjsr
ID OP2N6r9Z - Reporte de sobrantes y faltantes en cedis regionales ropa y muebles - Automatización,"Se requiere un reporte de los indicadores de faltantes y sobrantes que muestra la Evaluación Objetiva de las secciones de cedis productiva (Loteo, Rack, Piso) y cedis ropa (Colgado, Doblado, Zapatería y Picking) con la información concentrada de todos los cedis con una periodicidad mensual.",https://trello.com/c/OP2N6r9Z,2022-10-10 11:12:13,Done,5a39340780c7018abc846f6b,2022-10-26 09:32:46,Uriel López,uriellopez4,GCIA Cadena de Suministro,6.965439814814815,82.42771990740741,4.733101851851852,2.181574074074074,,2.0508217592592595,OP2N6r9Z
ID aSEpaHK5 - Indicadores $ Costo por Servicio Liquidado Ropa para comité,"Se solicita por parte de la función de transporte actualizar los indicadores correspondiente a Costo por Servicio Liquidado Ropa para Septiembre 2022
",https://trello.com/c/aSEpaHK5,2022-10-13 18:33:59,Done,5a384ee5d3e6d3977fb436e7,2022-10-20 08:00:54,Carolina Amarillas,carolinaamarillas,GCIA Cadena de Suministro,0.0015624999999999999,88.49152777777778,6.558657407407408,4.6296296296296294e-05,5.7870370370370366e-05,3.472222222222222e-05,aSEpaHK5
ID WfYWId5I - Indicadores Cobro por servicios entregados por compra mínima y zona extendida,"Actualización de los indicadores que se crearon para la función de Transporte, se adjunta ejemplo
",https://trello.com/c/WfYWId5I,2022-10-13 18:38:27,Done,5a384ee5d3e6d3977fb436e7,2022-10-24 08:01:44,Carolina Amarillas,carolinaamarillas,GCIA Cadena de Suministro,0.0014699074074074074,84.49094907407407,6.912974537037036,2.3148148148148147e-05,2.3148148148148147e-05,3.643148148148148,WfYWId5I
Dashboard Venta Club Protección,"Generación de dashboard para visualizacion de ventas de cada club de protección (familiar, salud, moto, víal)


Actualización:
-Se esta buscando la manera de hacer cruce de información para reconocer RC y Plus
El tablero ya se encuentra en producción
",https://trello.com/c/DnHx8bTV,2022-08-23 14:43:16,Sprint Backlog (En Proceso),62aa1026422f1f2832715a65,2022-10-04 15:23:57,Karla Berenice Roldan Reyes,berenice_roldanreyes,GCIA Seguros,,0.00019675925925925926,0.00015046296296296297,,,146.21167824074072,DnHx8bTV
Descargos Muebles,"Gestionar los datos de los descargos por robo y/o fenomes metereologicos, este dato se requiere para conectar los descargos de cada centro dentro de los indicadores de la evaluación objetiva. Se esta llevando a cabo con Emigdio Valencia del área de cadena de suministros. ",https://trello.com/c/mmMqLYnq,2022-08-10 16:31:08,Done,61b649de354cf05e929f1b08,2022-10-25 07:56:59,leopoldo.zuniga,leopoldozuniga2,"GCIA Finanzas, Contabilidad",7.736956018518519,83.49414351851853,6.641238425925926,0.00047453703703703704,,61.2642824074074,mmMqLYnq
"Arise: Unión Carteras (Ropa, Prestamos Personales, Muebles, Reestructura)","Se requiere hacer el decodificado para la union de carteras en el ambiente PDW, con base a la informacion que nos compartieron de AKYA.

‌",https://trello.com/c/N3R4xzYD,2022-08-10 16:31:56,Done,61b649de354cf05e929f1b08,2022-10-05 08:01:50,leopoldo.zuniga,leopoldozuniga2,"GCIA Finanzas, Contabilidad",,103.49077546296297,47.92427083333333,,,7.721493055555556,N3R4xzYD
"Margen Neto, sólo Argentina, sólo México","Separar los modelos de México y Argentina.

1. Crear  Histórico de MX para que en el modelo en blanco actual de Oracle se pueda tener tener el modelo de México Completo.
 
2. Dar de Baja del Modelo de Margen Neto Blanco (viejo) los datos de MEX para que quede solamente el dato de ARG.
",https://trello.com/c/pTm3RVLD,2022-08-10 16:33:06,Done,61b649de354cf05e929f1b08,2022-10-25 08:31:56,leopoldo.zuniga,leopoldozuniga2,"GCIA Finanzas, Contabilidad",,83.4698726851852,27.62332175925926,,1.9649999999999999,46.077534722222225,pTm3RVLD
Margen en Blanco - Migración Oracle,Conectar el Margen Neto a Oracle con todos sus componentes.,https://trello.com/c/JJ4wuyvJ,2022-08-10 16:33:46,Done,61b649de354cf05e929f1b08,2022-10-05 08:01:50,leopoldo.zuniga,leopoldozuniga2,"GCIA Finanzas, Contabilidad",,103.49079861111112,55.6444675925926,,,,JJ4wuyvJ
Margen en Blanco - M2 Ajustes,"Validar el campo de Metros Cuadrados de los modelos de Margen para que no existan Tiendas sin asignación de M2.

NOTA: Esta actividad pega directamente con el tema de OPV.",https://trello.com/c/CgPTqZqc,2022-08-18 09:35:03,Done,61b649de354cf05e929f1b08,2022-10-25 08:34:14,leopoldo.zuniga,leopoldozuniga2,"GCIA Finanzas, Contabilidad",,83.46829861111111,4.996203703703704,,36.25623842592592,26.70532407407407,CgPTqZqc
Margen Neto y en Blanco - ajustes de automatización desde la consola,"Se requiere realizar la modificación de los Archivos ETL y FrontEnd para que al ejecutar el modelo desde el Management Console de QlikView éste concluya sin conflictos, ésto tiene como finalidad ejecutar el último Procedimiento almacenado para la creación de tablas de la información de carteras del Margen.",https://trello.com/c/mC6vBJo0,2022-08-18 09:38:07,Done,61b649de354cf05e929f1b08,2022-10-05 08:01:50,leopoldo.zuniga,leopoldozuniga2,"GCIA Finanzas, Contabilidad",,103.49079861111112,11.684340277777778,,35.04623842592593,1.2025578703703703,mC6vBJo0
"Activación de Producto: Segmento, Categoría, Departamento, Clase y Familia",Alinear el registro de DCFs y Categorías desde el Sistema de Inventarios para que en la contabilidad de Oracle se registre el detalle de ambos y se puedan obtener los datos contables descritos por Categoría (DCFs). ,https://trello.com/c/RkkSC9nz,2022-08-18 10:10:18,Done,61b649de354cf05e929f1b08,2022-10-04 09:02:24,leopoldo.zuniga,leopoldozuniga2,"GCIA Finanzas, Contabilidad",,104.44873842592591,6.9585995370370375,,39.99086805555556,0.0033796296296296296,RkkSC9nz
Reproceso automático de categorías,"Reprocear la información de categorías de al menos los últimos tres años, esto es el actual y dos años hacia atrás de manera automática

Antecedente:

Actualmente de correr 4 procesos manuales cada mes para cargar los datos del mes en turno y pueda ser consultado el informe,

Los pasos a seguir: Unificar, migrar y optimizar los procesos en uno solo, migrar el informe en reporting a la nueva ruta de finanzas, modificar diseño y por ultimo establecer dentro del proceso/cargado la regla de que cuando exista una nueva categoria se debe reprocesar la historia y de no haber cargar el mes mas reciente.",https://trello.com/c/wvV9A9wW,2022-09-01 09:51:36,Done,61b649de354cf05e929f1b08,2022-10-11 08:39:06,leopoldo.zuniga,leopoldozuniga2,"GCIA Finanzas, Contabilidad",11.290891203703703,97.46493055555555,6.986759259259259,10.96722222222222,,10.704780092592593,wvV9A9wW
Reporte recurrente de Celulares Proyecto Apple,"De: Anna Giselle Cardenas Cazares
Actualmente se está desarrollando un proyecto para incrementar la venta de IPhone en Coppel por parte de la categoría de celulares, por lo que se está trabajando en un modelo  para medir la utilidad de dicho proyecto, sin embargo, requerimos la siguiente información para poder avanzar:
Venta neta y costo de venta de los SKUs que se enlistan en el documento adjunto de manera mensual a partir de enero 2021 a agosto 2022. 
La información se requiere de manera separada por Telcel y Telefonía Libre (en el documento se etiquetan los SKUs) 
Entiendo que no en todos los conceptos podemos obtener la información a nivel SKU, pero el mayor detalle que nos puedan compartir sería de mucha utilidad. ",https://trello.com/c/f0dRhdqr,2022-09-21 08:32:40,Done,6262e4cee24c33230ef9f064,2022-10-06 08:00:57,Moises Corrales Esparza,moy_corrales,"GCIA Finanzas, Contabilidad",8.366944444444444,102.49144675925925,6.587002314814814,0.0009143518518518518,0.0004050925925925926,0.022708333333333334,f0dRhdqr
Unificación,En base a los 4 procesos preexistentes se debe generar uno solo que cumpla la función de proveer el dataset para el reporte,https://trello.com/c/KkGPKWmv,2022-09-22 08:11:28,Done,61b649de354cf05e929f1b08,2022-10-11 08:39:10,leopoldo.zuniga,leopoldozuniga2,"GCIA Finanzas, Contabilidad",,97.46490740740741,6.986701388888889,1.3278935185185186,,10.704641203703703,KkGPKWmv
Migración,Se debe migrar el proceso unificado y el dataset (tabla) que genera a la base Dirección Finanzas y en el caso del dataset dentro del esquema apropiado (Reporting),https://trello.com/c/okslEyvu,2022-09-22 08:15:54,Done,61b649de354cf05e929f1b08,2022-10-11 08:39:14,leopoldo.zuniga,leopoldozuniga2,"GCIA Finanzas, Contabilidad",,97.46486111111112,6.9866782407407415,1.3248842592592591,,10.704641203703703,okslEyvu
Optimización,Generar un reporte con un aspecto visual apropiado y conectado a datos mejor ordenados,https://trello.com/c/02EZZ91r,2022-09-22 08:16:07,Done,61b649de354cf05e929f1b08,2022-10-11 08:39:16,leopoldo.zuniga,leopoldozuniga2,"GCIA Finanzas, Contabilidad",,97.46483796296296,6.986608796296296,1.324837962962963,,10.704629629629629,02EZZ91r
Depurar todos los procesos y dejar el último nada mas,,https://trello.com/c/SCPBXih2,2022-09-22 10:46:40,Done,615f7881e7055586c22cb732,2022-10-05 08:01:49,José Juan,jose_juan_herrera,"GCIA Finanzas, Contabilidad",,103.4908449074074,12.884363425925926,,,0.0011574074074074076,SCPBXih2
Ejecutar desde Escritorio Remoto y verificar que corrar sin ningún problema para Control de Gastos,"Lo que se requiere es generar una tarea en la consola de administración de QlikView para que se corra el último procedimiento almacenado y se cargue en automático en el modelo del Access Point de QV, ésto para que en cuanto se tengan los datos de cartera cualquier usuario con licencia de QV pueda ejecutar el modelo desde la consola de admon y no tener que abrir el archivo manualmente y darle recargar.",https://trello.com/c/YHimU2W8,2022-09-22 10:47:08,Done,615f7881e7055586c22cb732,2022-10-07 15:59:20,José Juan,jose_juan_herrera,"GCIA Finanzas, Contabilidad",,101.1592361111111,,,,15.216805555555554,YHimU2W8
Validar,,https://trello.com/c/GUmCL7IX,2022-09-22 14:50:05,Done,615f7881e7055586c22cb732,2022-10-07 15:59:27,José Juan,jose_juan_herrera,"GCIA Finanzas, Contabilidad",,101.15915509259258,,,,15.048171296296296,GUmCL7IX
"Arise: Transacciones (abonos, ventas y servicios de garantía)","Se requiere hacer el decodificado de las transacciones para el PDW, con base a la informacion que nos compartieron de AKYA.

‌",https://trello.com/c/aece1Xvb,2022-10-03 10:40:39,Done,615f71d235806a64ce61a313,2022-10-06 08:37:29,Jesús Paredes,jesusparedes26,"GCIA Finanzas, Contabilidad",,102.46608796296296,2.9144675925925925,,,,aece1Xvb
Arise: Remediación Transacciones (Muebles),"Se requiere hacer la remediación al campo de “Cliente_Factura”, para poder quitar el Digito Verificador, ya que al momento de hacer la validación se ve que los resultados son inconsistentes para el caso de la cartera Muebles.

‌",https://trello.com/c/9KoGrgDJ,2022-10-03 10:42:41,Done,615f71d235806a64ce61a313,2022-10-06 08:37:34,Jesús Paredes,jesusparedes26,"GCIA Finanzas, Contabilidad",,102.46603009259259,2.913113425925926,,,,9KoGrgDJ
ID vEYagPS4 - Centro de Comando - Eliminar IVA a columna de Abono,Se solicita eliminar el IVA de los montos de abono de las pestañas de ventas credito ropa prepago (mensual) y ventas credito muebles  prepago (mensual) - columna I como referencia -,https://trello.com/c/vEYagPS4,2022-10-03 13:04:21,Done,61b649de354cf05e929f1b08,2022-10-27 09:02:36,leopoldo.zuniga,leopoldozuniga2,"GCIA Finanzas, Contabilidad",7.816689814814815,81.44865740740741,0.00011574074074074073,,16.01517361111111,0.0001388888888888889,vEYagPS4
ID 2T4EX0CQ - Folio APS # 36542 ARISE - Ajustes Cartera Préstamos Muestra 1500 Clientes,Realizar ajustes a la muestra de clientes para el proyecto,https://trello.com/c/2T4EX0CQ,2022-10-05 15:40:24,Done,61b649de354cf05e929f1b08,2022-10-10 12:46:51,leopoldo.zuniga,leopoldozuniga2,"GCIA Finanzas, Contabilidad",4.769606481481482,98.29292824074075,,0.10987268518518518,,,2T4EX0CQ
ID ih0C8aI6 - Folio APS # 36556	ORACLE - DireccionFinanzas.dbo.QV_Oracle_Margen_GastosporCentroMN,"Como parte del proyecto de Migración del nuevo sistema contable Oracle, hay que migrar cada uno de los 34 procesos ue se usan para estos modelos donde por cada proceso de debe de:

- Sacar una copia del mismo, renombrar, cambiarlo de bd.
- Dentro del mismo todas las tablas que se formen debe apuntar a una nueva bd de finanzas donde quedaran de manera oficial.
- Donde se usen las fuentes del sistema legado es decir las tablas de gastos debemos suplirlas por las nuevs que se formron del sistema contable oracle.
",https://trello.com/c/ih0C8aI6,2022-10-05 15:41:17,Done,61b649de354cf05e929f1b08,2022-10-10 12:46:58,leopoldo.zuniga,leopoldozuniga2,"GCIA Finanzas, Contabilidad",4.772754629629629,98.29284722222224,,0.10619212962962964,,,ih0C8aI6
