ID hJi9zlIm - Apagado del rubro Faltante vs Venta Muebles en indicador de zapatería 766-02,"Se solicita el apagado del indicador de % Faltante vs Venta Muebles en Zapatería de la Tienda 766 región VRCZ, te comparto la situación presentada donde taller de servicio cargo por error operativo las siguientes pólizas. 

Te comparto la problemática:
Gerente de zapatería Gabriela Rojas González del centro 766-02, en su indicador en el rubro del % Faltante vs Venta Muebles de zapatería, bodega 30019 le están cargando las siguientes pólizas que te comparto a continuación.

En el costo unitario le está afectado a la tienda, ya que no compensan 100% en el precio y más porque son dos cambios físicos de artículos como parte de la solución brindada al cliente en un servicio y garantía, las cuales fueron generadas en taller de servicios de la región por un error operativo. 

Donde estas pólizas no se debieron haber generado ya que son cambios con cargo al centro y por error operativo de por parte de taller de servicio las generaron como pólizas de faltante y sobrante de muebles al centro 76602 y no como un gasto del centro, por lo cual surgió un error operativo por parte del taller de servicio, la cual afecto a la tienda este movimiento es sus indicadores. 

Ya que estos números le afectarán 3 meses el resultado de tienda. 

Por lo que se solicita se apague del rubro % Faltante vs Venta Muebles en Zapatería al indicador en los meses de Agosto 2022, Septiembre 2022 y Octubre 2022 para centro de zapatería 766-02 región VRCZ, ya que tiene afectación 3 meses en su centro, esto provocado por un error operativo de por parte de taller de servicios.

Pólizas que realizaron la afectacion al centro 766-02
Faltante y Sobrante -> Bodega 30019
•	Póliza 756643 Código 279429 TV LED LG 43UQ8000PSB                                                              
Costo Unitario: -5,350.18
•	Póliza 756644 Código 919261764 (284405) -- TV LED HISENSE 43H4000GM                               
Costo Unitario: 828.00

•	Póliza 758753 Código: 650978 REFRIGERAD SAMSUNG RT38A5930BS/EM 14P                       
Costo Unitario: -8,597.76
•	Póliza 758755 Código: 919681447 (646237) -- REFRIGERAD MABE RME360FDMRP0 14P        
Costo Unitario: 1,655.00

Comentarios Rosario Esther Gabriel Melgarejo (Gerente De Área Cedis)
En seguimiento al correo que antecede, respecto al tema de la tienda 766, en la imagen se puede apreciar la respuesta por parte de la gerente de tienda, misma que al contactar vía telefónica, así como, en las SA 105515392 y 105516314, comenta que consideraba que  al aceptar el cargo para su tienda se iba al gasto y no mediante pólizas. 

Por parte de los talleres de servicio, a partir del mes de enero de 2022 y como parte de los seguimientos al Servicio post-venta, se comparte con los Gerentes de Tienda los detalles de los SG, que presentan una situación especial o cuando la solución se pudo brindar en tienda con base a la Guía de situaciones especiales y lista de cambios rápidos, herramientas con las que cuentan en tienda, principalmente cuando las condiciones de los artículos no se encuentran dentro de los parámetros de aceptación para Devolución a Proveedor, esta acción, se realiza  por medio de una S.A para que con pleno conocimiento del Gerente de tienda  brinde sus comentarios  y no se realiza ningún movimiento hasta contar con la autorización por escrito para la solución al cliente. 

Con el fin de colaborar en todo aquello que sea posible, quedo a sus órdenes y atenta a sus comentarios.

Comentarios Adriana Basilisa Trejo Martin (Gerente Zona Tiendas)
Se había abordado en una conferencia en el cual asistió Carlos Castro, La gerente de taller Rosario y el gerente de zona cedís que estaba en turno, en ese Meet se comentó que no era un proceso hacer un cargo del faltante a la tienda por cuestión de un cambio físico, sin embargo, observó que se realizó de nuevo este proceso el cual entiendo no está estipulado en ningún manual.

Sin más por el momento solicito se haga el reverso de las pólizas ya que de no ser así afectará tres meses el indicador de la tienda.

Comprendo y entiendo que no se aplicó lo establecido en la guía del SIP, y me enfocaré para verificar que se haga el proceso correcto dentro de tienda.",https://trello.com/c/hJi9zlIm,2022-10-11 07:56:12,Done,5bacfc5de184314092f6150f,2022-10-28 08:36:39,Luis Verdugo,luisverdugo1,"GCIA Operación Retail y Servicios Financieros, Inmobiliaria, Diseño y Construcción",6.2284953703703705,80.46668981481481,3.9929976851851854,0.0018634259259259257,0.0002199074074074074,3.61099537037037,hJi9zlIm
ID FaGJSP9O - [10-10-2022]Actualización de Lista de Colaboradores,"Se solicita actualizar los correos y centros para el informe "" colaboradores División ciencia de datos"", el cual se comparte todos los Lunes.  ",https://trello.com/c/FaGJSP9O,2022-10-11 17:20:32,Done,6283c252744da02c7510fc81,2022-10-11 17:44:39,Emma Guadalupe Quinonez Espinoza,emmaguadalupequinonezespinoza,"GCIA Operación Retail y Servicios Financieros, Inmobiliaria, Diseño y Construcción",0.011967592592592592,97.08613425925925,0.004432870370370371,0.0001273148148148148,0.00010416666666666667,0.00011574074074074073,FaGJSP9O
ID mntmYA1e - Reporte de indicadores Diarios para Prueba Piloto Incentivos,"Un tablero con cortes diarios a t-1 que permita el seguimiento puntual del
desempeño del grupo de sucursales elegidas para la prueba piloto de la nueva evaluación
objetiva y pago de incentivos. Considerar las siguientes condiciones:
- El alcance inicial del tablero está orientado al puesto de Cajero de Abonos;
conforme se vaya haciendo la liberación de pruebas piloto del resto de puestos se
requerirá de un tablero de seguimiento, con las mismas características, para cada
uno de los puestos.
-El tablero se requiere inicialmente para las sucursales que están en fase de
prueba piloto.
- El tablero funcionará de manera operativa y permanente para el total de las
sucursales una vez que se haga la implementación a nivel nacional.
- Para todas las sucursales que se encuentran en fase de prueba piloto se deberá
incluir a manera de comparativo visual su correspondiente sucursal espejo.
- El tablero deberá estar alimentado por un histórico que correrá desde el 1 de
enero de 2021 hasta la fecha t-1, sin embargo, al inicio de la revisión deberá tener
precarga la información para los periodos indicados en las especificaciones.",https://trello.com/c/mntmYA1e,2022-10-13 17:04:27,Done,62ebfc64fca4a43a4e6930b9,2022-10-21 11:13:56,Jorge Arturo Sandoval Palazuelos,jorgearturosandovalpalazuelos1,"GCIA Operación Retail y Servicios Financieros, Inmobiliaria, Diseño y Construcción",0.001099537037037037,87.35747685185186,2.6766435185185187,8.101851851851852e-05,8.101851851851852e-05,5.078680555555556,mntmYA1e
ID 8mnnPBsH - Actualización de la base de Evaluación Objetiva en el Modelo de Tableau,Actualizar la base que llena el modelo de la Evaluación Objetiva de Tiendas en Tableau.,https://trello.com/c/8mnnPBsH,2022-10-14 10:56:17,Done,62e80a7947fc560fee79d1b4,2022-10-19 10:11:46,William Rojo Cuén,williamrojocuen,"GCIA Operación Retail y Servicios Financieros, Inmobiliaria, Diseño y Construcción",0.039282407407407405,89.40064814814815,1.9151157407407409,1.1574074074074073e-05,,3.0134143518518517,8mnnPBsH
ID H7N19dfd - Migrar Evaluación Objetiva GEX de Crystal Reports a Report Builder,Migrar Evaluación Objetiva GEX (Gerente de Exhibición) de Crystal Reports a Report Builder,https://trello.com/c/H7N19dfd,2022-10-14 11:17:34,Done,62e81161ab536611b308cfc5,2022-10-20 09:15:56,Blanca Mayely López Camacho,blancamayelylopezcamacho,"GCIA Operación Retail y Servicios Financieros, Inmobiliaria, Diseño y Construcción",0.02666666666666667,88.4394212962963,1.0422916666666666,0.00047453703703703704,4.6296296296296294e-05,4.846053240740741,H7N19dfd
ID abV4DEok - Bases de Datos transaccionales para incentivos de Patio Financiero,"Se requiere la siguiente información para la construcción y análisis de indicadores a proponer en la medición de los incentivos para el Patio Financiero:
-----------------------------------------------------------------------------

- Información referente a solicitudes de Préstamos BanCoppel, Tarjetas Coppel y Tarjetas de Crédito BanCoppel
- Información referente a entregas de Préstamos BanCoppel, Préstamos Coppel, Tarjetas Coppel y Tarjetas de Crédito BanCoppel
- Información referente a apertura de cuentas de captación: Efectiva, Nómina, Pagaré, Inversión creciente, Click
- Información referente a las transacciones realizadas en las cajas (ventanillas) de BanCoppel

Se requiere generar histórico de 18 meses hacia atrás y actualización mensual en PDA",https://trello.com/c/abV4DEok,2022-10-14 19:30:58,Done,6310ea9621ec8101eab24203,2022-10-28 08:35:46,Diego Lopez Orozco,diegolopezorozco,"GCIA Operación Retail y Servicios Financieros, Inmobiliaria, Diseño y Construcción",5.94505787037037,80.46731481481481,3.601944444444445,0.00011574074074074073,0.9609375,3.0369444444444444,abV4DEok
ID Vp7n1f5u - Gasto vs Venta - Operaciones en Muebles,"Adecuar el indicador complementario de operaciones por colaborador (gastos).
",https://trello.com/c/Vp7n1f5u,2022-10-17 15:25:40,Done,62e80a7947fc560fee79d1b4,2022-10-24 08:39:20,William Rojo Cuén,williamrojocuen,"GCIA Operación Retail y Servicios Financieros, Inmobiliaria, Diseño y Construcción",0.011724537037037035,84.46483796296296,4.997395833333333,0.0010300925925925926,4.6296296296296294e-05,1.7076273148148147,Vp7n1f5u
ID OkuxvWUo - ID Vp7n1f5u - Gasto vs Venta - Operaciones en Ropa,"Adecuar el indicador complementario de operaciones por colaborador (gastos).
",https://trello.com/c/OkuxvWUo,2022-10-19 08:38:32,Done,62e80a7947fc560fee79d1b4,2022-10-24 08:39:24,William Rojo Cuén,williamrojocuen,"GCIA Operación Retail y Servicios Financieros, Inmobiliaria, Diseño y Construcción",,84.46479166666667,4.9972916666666665,,,0.003310185185185185,OkuxvWUo
ID 9kwE4PpH - ID Vp7n1f5u - Gasto vs Venta - Operaciones en Cajas,"Adecuar el indicador complementario de operaciones por colaborador (gastos).
",https://trello.com/c/9kwE4PpH,2022-10-19 08:38:48,Done,62e80a7947fc560fee79d1b4,2022-10-24 08:40:17,William Rojo Cuén,williamrojocuen,"GCIA Operación Retail y Servicios Financieros, Inmobiliaria, Diseño y Construcción",,84.46417824074074,4.986736111111111,,,0.014293981481481482,9kwE4PpH
ID GcfhfgEc - ID Vp7n1f5u - Gasto vs Venta - Operaciones en Zapaterías,"Adecuar el indicador complementario de operaciones por colaborador (gastos).
",https://trello.com/c/GcfhfgEc,2022-10-19 08:39:00,Done,62e80a7947fc560fee79d1b4,2022-10-24 08:40:31,William Rojo Cuén,williamrojocuen,"GCIA Operación Retail y Servicios Financieros, Inmobiliaria, Diseño y Construcción",,84.46401620370371,4.721018518518519,,,0.2800347222222222,GcfhfgEc
ID vW4vGRKT - ID Vp7n1f5u - Gasto vs Venta - Operaciones en C-Digital,"Adecuar el indicador complementario de operaciones por colaborador (gastos).
",https://trello.com/c/vW4vGRKT,2022-10-19 08:39:13,Done,62e80a7947fc560fee79d1b4,2022-10-24 08:40:34,William Rojo Cuén,williamrojocuen,"GCIA Operación Retail y Servicios Financieros, Inmobiliaria, Diseño y Construcción",,84.46398148148148,4.628564814814815,,,0.3723726851851852,vW4vGRKT
ID X5aw2EH4 - ID Vp7n1f5u - Gasto vs Venta - Operaciones en Solo Ropa,"Adecuar el indicador complementario de operaciones por colaborador (gastos).
",https://trello.com/c/X5aw2EH4,2022-10-19 08:42:25,Done,62e80a7947fc560fee79d1b4,2022-10-24 08:40:37,William Rojo Cuén,williamrojocuen,"GCIA Operación Retail y Servicios Financieros, Inmobiliaria, Diseño y Construcción",,84.46394675925926,3.9659374999999994,,,1.0328125000000001,X5aw2EH4
ID DkaU4dKr - ID Vp7n1f5u - Gasto vs Venta - Operaciones en Tienda de Remate,"Adecuar el indicador complementario de operaciones por colaborador (gastos).
",https://trello.com/c/DkaU4dKr,2022-10-19 08:42:33,Done,62e80a7947fc560fee79d1b4,2022-10-24 08:40:41,William Rojo Cuén,williamrojocuen,"GCIA Operación Retail y Servicios Financieros, Inmobiliaria, Diseño y Construcción",,84.46390046296297,3.8859490740740736,,,1.1127546296296296,DkaU4dKr
ID WuRpFKvp - ID Vp7n1f5u - Gasto vs Venta - Operaciones en Agencia Motos,"Adecuar el indicador complementario de operaciones por colaborador (gastos).
",https://trello.com/c/WuRpFKvp,2022-10-19 08:42:51,Done,62e80a7947fc560fee79d1b4,2022-10-24 08:40:45,William Rojo Cuén,williamrojocuen,"GCIA Operación Retail y Servicios Financieros, Inmobiliaria, Diseño y Construcción",,84.46385416666666,3.8573495370370368,,,1.1411921296296297,WuRpFKvp
ID kP68cSAi - ID Vp7n1f5u - Gasto vs Venta - Operaciones en Fashion Market,"Adecuar el indicador complementario de operaciones por colaborador (gastos).
",https://trello.com/c/kP68cSAi,2022-10-19 08:43:01,Done,62e80a7947fc560fee79d1b4,2022-10-24 08:40:48,William Rojo Cuén,williamrojocuen,"GCIA Operación Retail y Servicios Financieros, Inmobiliaria, Diseño y Construcción",,84.46381944444444,3.7694097222222225,,,1.229050925925926,kP68cSAi
ID gUYNvixY - Reporte Comparativo de Resultados en la EO Cajas de Abono vs EO por Función Cajero de Abonos,Realizar un reporte con los resultados de la Evaluación Objetiva tradicional de Cajas de Abono y los resultados de la Evaluación Objetiva por Función de Cajero de Abonos para los meses de agosto y septiembre 2022.,https://trello.com/c/gUYNvixY,2022-10-20 16:42:09,Done,62e80a7947fc560fee79d1b4,2022-10-25 09:28:31,William Rojo Cuén,williamrojocuen,"GCIA Operación Retail y Servicios Financieros, Inmobiliaria, Diseño y Construcción",0.0013194444444444443,83.43068287037038,4.649953703703704,3.472222222222222e-05,3.472222222222222e-05,0.04752314814814815,gUYNvixY
ID iJ7dctiZ - Actualización de la Base de la Estrúctura Financiera en el Modelo de Evaluación Objetiva por Función,"Intercambiar las bases de la estrúctura de Servicios Financieros utilizados por la tabla oficial, obtenida recientemente.",https://trello.com/c/iJ7dctiZ,2022-10-21 11:50:04,Done,62e80a7947fc560fee79d1b4,2022-10-24 08:40:38,William Rojo Cuén,williamrojocuen,"GCIA Operación Retail y Servicios Financieros, Inmobiliaria, Diseño y Construcción",0.0010416666666666667,84.46393518518518,2.658912037037037,2.3148148148148147e-05,3.472222222222222e-05,0.20843749999999997,iJ7dctiZ
"ID n7JOBzlm - ID yl8RfNVK - ID Yji4XeY2 - [21-10-2022] - Actualización informe ""Colaboradores División Ciencia de Datos""","Se solicita actualizar los correos y centros para el informe ""Colaboradores División Ciencia de Datos"" , el cual se comparte todos los días lunes al área de Talento.
https://docs.google.com/spreadsheets/d/1o49ef7AukNdmKfF1Ed4D8b_RxmYXUua7Pows__jDaaI/edit#gid=686790669",https://trello.com/c/n7JOBzlm,2022-10-24 15:07:43,Done,6283c252744da02c7510fc81,2022-10-28 08:36:53,Emma Guadalupe Quinonez Espinoza,emmaguadalupequinonezespinoza,"GCIA Operación Retail y Servicios Financieros, Inmobiliaria, Diseño y Construcción",0.7268634259259259,80.46655092592592,3.001400462962963,9.259259259259259e-05,6.944444444444444e-05,0.00015046296296296297,n7JOBzlm
36036.1 - SCORECARD PROVEEDOR ADICIONALES 23 JUNIO 2022,OBJETIVO Ofrecer un modelo de Qlikview de acuerdo a los requerimientos solicitados por el área comercial. JUSTIFICACIÓN: A solicitud de Gerencia Nacional se solicita agregar los adicionales mencionados en esta petición.,https://trello.com/c/NI0n6CTT,2022-08-12 19:40:34,Done,615f3aba4b5e53331e333745,2022-10-13 08:01:04,Carlos Flores,carlosflores389,"GCIA Comercial Muebles (Ventas, Proveedores, eCommerce), Mkt, Exhibi.",25.94134259259259,95.49131944444444,6.685520833333334,,,28.88737268518519,NI0n6CTT
"Tablero Comercial - Sección ""Resumen Comercial - Ropa + Zapatos""",Generar en el Tablero Comercial la sección de indicadores de Ropa + Zapatos.,https://trello.com/c/4WAM0jmt,2022-08-25 15:43:01,Done,577e8e09c4791fbbbab2a020,2022-10-05 08:01:17,Avelino Verdugo,avelinoverdugo,"GCIA Comercial Muebles (Ventas, Proveedores, eCommerce), Mkt, Exhibi.",,103.49118055555554,26.98028935185185,,,13.699062500000002,4WAM0jmt
37001.1 - REPORTE_Clientes Cotizan y compran-Cumplimiento por División_por Región,"Se solicita el apoyo para obtener los resultados que se trabajaron para enviar un informe a las tiendas sobre la venta de motos, los clientes cotizan y los clientes cotizan y compran, además del % de cumplimiento general de cotizan y compran.

En lugar de todas las tiendas, tenerlo por División y poder tenerlo también por región y así poder pasar esta información a los gerentes ya que son competitivos y les gusta conocer sus propios números y enfocarse en las áreas a trabajar.",https://trello.com/c/QP2Ky77x,2022-09-09 15:40:13,Done,615f3aba4b5e53331e333745,2022-10-13 08:01:02,Carlos Flores,carlosflores389,"GCIA Comercial Muebles (Ventas, Proveedores, eCommerce), Mkt, Exhibi.",5.07457175925926,95.49137731481483,7.008356481481481,5.9325578703703705,,15.665636574074073,QP2Ky77x
37049.1 - NUEVO MARGEN RECONSTRUIDO - NUEVA LÓGICA DE CALCULO - Modelo Compras Muebles,"Agregar las mejoras realizadas por Sistemas Compras al modelo de QlikView Compras Muebles en Utilidad Reconstruida y Margen Reconstruido. De acuerdo a la petición 35298.1 Modelo Compras Muebles - Nueva lógica de cálculo del Margen Reconstruido quedaba como pendiente por parte de Sistemas Compras, la modificación del cálculo del indicador tomando en cuenta el importe a recuperar para tiendas de interior y frontera.",https://trello.com/c/wxr3nFad,2022-09-19 10:52:32,Done,615f3aba4b5e53331e333745,2022-10-14 08:01:00,Carlos Flores,carlosflores389,"GCIA Comercial Muebles (Ventas, Proveedores, eCommerce), Mkt, Exhibi.",18.26417824074074,94.49141203703704,6.6166782407407405,,,2.3148148148148147e-05,wxr3nFad
Copiado de Tabla Para Reporte de Dirección Comercial,"Por medio del presente solicito su apoyo para copiar las siguientes tablas con origen del servidor 10.44.1.141:

IndiceDesempenoMuebles.dbo.Indice1PeriodoCodigosClase
IndiceDesempenoMuebles.dbo.Indice3PeriodosCodigosClase
IndiceDesempenoMuebles.dbo.Indice13PeriodosCodigosClase
ComprasMuebles.dbo.Indice12MesesCodigosClase
ComprasMuebles.dbo.Indice3MesesCodigosClase 
ComprasMuebles.dbo.Indice1MesCodigosClase

Se solicita un copiado completo directamente sobre el destino DireccionComercial con el mismo nombre con el que cuentan.

- Periodicidad que se manejará (diaria, mensual)
Se solicita el copiado de las tablas de manera mensual, los días 7 de cada mes

- Con quien viste el tema de esas fuentes o contacto para revisar las dudas, documentación y demás.
Los contactos para toda ésta información pudieran ser Karelia Guadalupe Romero Romo o Verenice Parra Angulo, son las encargadas de dichas tablas.",https://trello.com/c/jOsAx9oB,2022-09-20 09:07:28,Done,615f3aba4b5e53331e333745,2022-10-10 09:12:12,Carlos Flores,carlosflores389,"GCIA Comercial Muebles (Ventas, Proveedores, eCommerce), Mkt, Exhibi.",0.0005671296296296296,98.44196759259258,4.056921296296296,,,15.94579861111111,jOsAx9oB
37104.1 - Set de datos Modelo de Costos logísticos 2022,Contar con los Sets de Datos de costos logísticos actualizados para el el año 2022 como los trabajados en la petición 33178.1 - SETs de Datos para Modelo Costos Logísticos,https://trello.com/c/1B33A4rA,2022-09-27 16:25:59,Done,615f3aba4b5e53331e333745,2022-10-18 08:00:56,Carlos Flores,carlosflores389,"GCIA Comercial Muebles (Ventas, Proveedores, eCommerce), Mkt, Exhibi.",0.0007291666666666667,90.4914699074074,6.668449074074075,,,13.980092592592591,1B33A4rA
ID zED71ls8 - REPORTE_Clientes Cotizan y compran-Cumplimiento por División_por Región_con Meta,"Se solicita el apoyo para obtener los resultados que se trabajaron para enviar un informe a las tiendas sobre la venta de motos, los clientes cotizan y los clientes cotizan y compran, además del % de cumplimiento general de cotizan y compran.

En lugar de todas las tiendas, tenerlo por División y poder tenerlo también por región y así poder pasar esta información a los gerentes ya que son competitivos y les gusta conocer sus propios números y enfocarse en las áreas a trabajar.

*Al reporte 37001 que ya se está trabajando agregar la columna de ""Meta Total"" que solicitó que se agregara recién Eduardo Zavala de Función compras motos.",https://trello.com/c/zED71ls8,2022-09-27 16:48:08,Done,5be6156a46f7b4199ee0e0e7,2022-10-13 08:01:02,maria de jesus calderon aguilar,mariadejesuscalderonaguilar,"GCIA Comercial Muebles (Ventas, Proveedores, eCommerce), Mkt, Exhibi.",1.6403240740740739,95.49140046296297,7.008113425925925,,,6.985520833333333,zED71ls8
37049.1 - NUEVO MARGEN RECONSTRUIDO - NUEVA LÓGICA DE CALCULO - Google Sheet,"Agregar las mejoras realizadas por Sistemas Compras al modelo de QlikView Compras Muebles en Utilidad Reconstruida y Margen Reconstruido. De acuerdo a la petición 35298.1 Modelo Compras Muebles - Nueva lógica de cálculo del Margen Reconstruido quedaba como pendiente por parte de Sistemas Compras, la modificación del cálculo del indicador tomando en cuenta el importe a recuperar para tiendas de interior y frontera.",https://trello.com/c/IiLoULp2,2022-09-28 08:29:12,Done,615f3aba4b5e53331e333745,2022-10-05 09:44:36,Carlos Flores,carlosflores389,"GCIA Comercial Muebles (Ventas, Proveedores, eCommerce), Mkt, Exhibi.",2.288391203703704,103.41947916666665,,,,4.763969907407407,IiLoULp2
"ID C4EJu9VT - 37150 - Ventas Muebles por Estado, Categoria y Clase (Sólo Tienda Física) (Jair Pérez)_Diaria","Se solita la actualización del folio 37108.1 el cual genera una base de datos con ventas a nivel Cartera, Categoría, Crédito, Contado, por canal, etc. Para esta actualización se solicita agregar el campo ""Estado"" y ""Clase de las categorías"" de la Cartera Muebles. Los datos son a nivel diario para los meses Agosto y Septiembre de los años 2019-2022. (Se contempla que los campos de numero de clientes y facturas de clientes a crédito estarán dudosos)",https://trello.com/c/C4EJu9VT,2022-09-29 18:04:24,Done,615f3aba4b5e53331e333745,2022-10-06 07:49:39,Carlos Flores,carlosflores389,"GCIA Comercial Muebles (Ventas, Proveedores, eCommerce), Mkt, Exhibi.",0.0016087962962962965,102.49930555555555,6.571481481481481,,,,C4EJu9VT
ID 2neTmsAa - Portafolio de Códigos a nivel Categoría-Clase-Familia para Ropa y Muebles,"El motivo de mi correo es solicitar tu ayuda generando una tabla del catálogo de Muebles, Ropa y Zapatos, hasta el nivel familia. Esto para cumplir con el pendiente del Comité de Directores ""Presentar en el próximo comité de categorías, todas las macro categorías y categorías de zapatos, ropa y muebles (incluído marketplace), para oficializar un reporte integral"". 
Te adjunto una tabla del formato con la información que necesitamos. ",https://trello.com/c/2neTmsAa,2022-10-05 09:41:08,Done,615f3aba4b5e53331e333745,2022-10-14 08:00:59,Carlos Flores,carlosflores389,"GCIA Comercial Muebles (Ventas, Proveedores, eCommerce), Mkt, Exhibi.",0.0022800925925925927,94.49144675925925,6.8218749999999995,,,2.1062962962962963,2neTmsAa
"ID vKTNrnPX - ID 2neTmsAa - Portafolio de Códigos a nivel CategoríaNivel1, Nivel2 Nivel3 de Marketplace para Ropa y Muebles","El motivo de mi correo es solicitar tu ayuda generando una tabla del catálogo de Muebles, Ropa y Zapatos, hasta el nivel familia. Esto para cumplir con el pendiente del Comité de Directores ""Presentar en el próximo comité de categorías, todas las macro categorías y categorías de zapatos, ropa y muebles (incluído marketplace), para oficializar un reporte integral"". 
Te adjunto una tabla del formato con la información que necesitamos. 

Debido a que no se tienen homologadas las clases de 1P con 3P, el objetivo es presentar el catálogo en 2 tablas diferentes. Te adjunto como se necesita el formato de Marketplace.",https://trello.com/c/vKTNrnPX,2022-10-05 09:46:06,Done,615f3aba4b5e53331e333745,2022-10-14 08:00:59,Carlos Flores,carlosflores389,"GCIA Comercial Muebles (Ventas, Proveedores, eCommerce), Mkt, Exhibi.",,94.49144675925925,6.821898148148148,,,2.1051041666666666,vKTNrnPX
ID 2alpRXEH - Integración de Boookins en Reportes para Calculo de Planta Categorías Muebles,Integración de Boookins en Reportes para Calculo de Planta Categorías Muebles,https://trello.com/c/2alpRXEH,2022-10-06 10:33:48,Done,615f3aba4b5e53331e333745,2022-10-07 11:19:02,Carlos Flores,carlosflores389,"GCIA Comercial Muebles (Ventas, Proveedores, eCommerce), Mkt, Exhibi.",0.0014351851851851854,101.35391203703703,1.029976851851852,,,,2alpRXEH
ID qejJdLj7 - P221006 - Mejoras en el performance del modelo de QlikView SAM,"Para mejorar el performance del modelo QlikView SAM, reducirá el volumen de datos realizando las siguientes acciones:

1.- Excluir el IdTipo=14 correspondiente al ""Pronostico"", ya que es un dato que no se refleja en el modelo.

2.-Modificar el costo de la familia 99901 cuando el IdTipo = 1-Venta TT y 13-Venta TI: AL COSTO SE LE RESTA EL 28.5% DE LOS PESOS CORRESPONDIENTE A LA FAMILIA 99901.

3.- Modificar las expresiones donde se utiliza los IdTipo = 18-Margenes TT y 19-Margenes TI, apuntando a los IdTipo = 1-Venta TT y 13-Venta TI.
",https://trello.com/c/qejJdLj7,2022-10-06 16:48:45,Done,5c4f87b99f35247b6a3cb894,2022-10-11 17:46:27,alejandro.chaparro,alejandrochaparro4,"GCIA Comercial Muebles (Ventas, Proveedores, eCommerce), Mkt, Exhibi.",0.0012037037037037038,97.08487268518519,,0.6285069444444444,,4.392581018518519,qejJdLj7
