ID pPsY54YK - Petición 37189.1 - Modificación de Reporte Operaciones por Centro TAE,"Necesitamos modificar el reporte de operaciones por centro de TAE con ruta: http://reporting.coppel.io/reports/report/InformesDiversos/Direcci%C3%B3n%20Comercial/Funci%C3%B3n%20Compras%20Muebles/Operaciones%20por%20Centro%20de%20Tiempo%20Aire Para que podamos generar el mismo seleccionando una fecha inicio y fin, nos ayudan a integrar este filtro por favor. De momento necesitamos el reporte para los siguientes periodos: * 15 Abril al 15 de Junio* *15 de Julio al 15 de Septiembre* Si es más sencillo que nos ayuden a generar los dos reportes con los rangos antes mencionados se los agradeceremos o bien nos ayudan a integrar el filtro para seleccionar las fechas y generarlo nosotros.",https://trello.com/c/pPsY54YK,2022-10-06 17:30:00,Done,615f3aba4b5e53331e333745,2022-10-13 09:42:19,Carlos Flores,carlosflores389,"GCIA Comercial Muebles (Ventas, Proveedores, eCommerce), Mkt, Exhibi.",0.726875,95.42107638888889,5.933587962962963,,,0.014756944444444446,pPsY54YK
ID aGdK7oSx - Copiado tabla para descuentos en Margen Reconstruido V2,"Buen dia Rosario / Rigo,

Se actualizó la información en el origen de la tabla para el copiado que se realiza a la tabla: DireccionComercial..CobroCodigoTienda_DescMargenReconstruido.

Favor de truncar el destino en PDW, realizar un copiado completo y se continúe con el copiado diario programado.
",https://trello.com/c/aGdK7oSx,2022-10-10 09:44:24,Done,615f3aba4b5e53331e333745,2022-10-21 09:03:39,Carlos Flores,carlosflores389,"GCIA Comercial Muebles (Ventas, Proveedores, eCommerce), Mkt, Exhibi.",0.0008449074074074074,87.44793981481483,,,,10.970856481481482,aGdK7oSx
ID pK0ROVf9 - Petición 37146.1 - Actualizar reporte de ventas de pantallas,"Actualizar reporte generado con petición 36447, al corte de Agosto de 2022, incluyendo el año 2017",https://trello.com/c/pK0ROVf9,2022-10-10 09:51:40,Done,615f3aba4b5e53331e333745,2022-10-18 08:00:56,Carlos Flores,carlosflores389,"GCIA Comercial Muebles (Ventas, Proveedores, eCommerce), Mkt, Exhibi.",0.006099537037037036,90.49149305555555,6.562662037037037,,,1.354340277777778,pK0ROVf9
ID SfkQYJs8 - Petición 37147.1 - Reporte de Clientes y Crédito,"Se solicita actualizar el reporte con el corte de Agosto de 2022 y la información del periodo del 2018. El reporte es para conocer el detalle de los clientes activos, así como linea disponible. Este informe en su mayoría ya se genera por parte de Alan Rodríguez Valenzuela de Control de Informes El folio de referencia del reporte anterior es de la petición 36470",https://trello.com/c/SfkQYJs8,2022-10-10 09:55:54,Done,615f3aba4b5e53331e333745,2022-10-18 08:00:55,Carlos Flores,carlosflores389,"GCIA Comercial Muebles (Ventas, Proveedores, eCommerce), Mkt, Exhibi.",0.00318287037037037,90.49150462962963,6.562650462962964,,,1.3543171296296297,SfkQYJs8
ID 4bY5lRFw - Petición 37118.1 - Reporte de Ventas Categoría Tecnología y Entretenimiento,"Nota: A diferencia del reporte anterior con folio 36446.1, se solicita información desde enero de 2017, así como actualizado al corte de Agosto de 2022. Se necesita información desglosada de las ventas de enero 2017 a la fecha de la categoría de Tecnología y Entretenimiento replicando el mismo en clasificación descendente hasta llegar las pantallas de las familias que representan aquellas de más de 50 pulgadas, de lo anterior se anexa archivo. Como referencia un informe similar ya se le pasa al área de Crédito y en su momento a celulares por parte de Alan Rodríguez Valenzuela de Control de Informes.",https://trello.com/c/4bY5lRFw,2022-10-10 09:59:09,Done,615f3aba4b5e53331e333745,2022-10-18 08:00:54,Carlos Flores,carlosflores389,"GCIA Comercial Muebles (Ventas, Proveedores, eCommerce), Mkt, Exhibi.",0.0009490740740740741,90.49151620370371,6.56263888888889,,,1.3542939814814814,4bY5lRFw
ID MzDUUJF1 - INFORMACIÓN MOTOS POR CLIENTE,"se realiza la petición para poder realizar análisis del segmento motos que contenga información a nivel cliente sobre los siguientes datos: No. de tienda, Ciudad, contado o crédito, Tipo de cliente, Plazo del crédito, limite de crédito autorizado, SKU, Mes, Año, Monto de intereses a pagar, Precio del artículo, Descuentos, Enganche y monto final a pagar.",https://trello.com/c/MzDUUJF1,2022-10-10 17:54:09,Done,6344ace0aa9c81019078c16b,2022-10-25 08:01:34,jose adrian stamatis ibarra,joseadrianstamatisibarra,"GCIA Comercial Muebles (Ventas, Proveedores, eCommerce), Mkt, Exhibi.",0.032233796296296295,83.49105324074074,6.573287037037037,,,7.982962962962964,MzDUUJF1
ID sJcrOAF8 - Datos Descuento Tipo 51 Mensual Total Muebles y por Categoría,Datos Descuento Tipo 51 Mensual Total Muebles y por Categoría,https://trello.com/c/sJcrOAF8,2022-10-11 15:56:39,Done,615f3aba4b5e53331e333745,2022-10-18 08:00:53,Carlos Flores,carlosflores389,"GCIA Comercial Muebles (Ventas, Proveedores, eCommerce), Mkt, Exhibi.",0.0008680555555555555,90.49152777777778,6.668738425925926,,,,sJcrOAF8
ID LuXkq1J9 - Petición 37174.1 - Reporte de Márgenes Categoría completa Transporte y Movilidad,"Un reporte de márgenes para la categoría completa de Transporte y Movilidad del año natural; en el que se pueda ver en los siguientes niveles la misma información del reporte en 3 pestañas: Nivel Marca, Nivel proveedor y Nivel Sku. Es necesario para un análisis de gastos que se realiza para la categoría de Transporte y Movilidad de manera periódica.
Código.- Todos los códigos de la categoría completa de Transporte y movilidad Artículo.- Artículo correspondiente al código Marca.- La marca correspondiente al código Modelo.- Modelo correspondiente al código Modelo Base.- Modelo base del código Número Proveedor.- Número de proveedor correspondiente al código Razón Social.- Razón social del proveedor correspondiente al código Meses de Venta.- Periodo de tiempo entre la primer venta y la fecha de corte Venta Unidades.- Venta del código en unidades acumulada de enero al mes del corte (considerar devoluciones) Costo Total.- Costo de ventas del código en el periodo Venta Pesos.- Venta del código en pesos acumuladas de enero al mes del corte Utilidad .- Venta Pesos menos Costo Total Servicios de Garantía (SG).- Cantidad de servicios de garantía acumuladas de enero al mes de corte(sin incluir re-incidencias) Reincidencias (R-I).- Cantidad de re-incidencias acumuladas de enero al mes del corte Devoluciones .- Cantidad de devoluciones acumuladas de enero al mes del corte Ordenes de Cambio (OC).- Cantidad de ordenes de cambio acumuladas de enero al mes del corte Costo SG+R-I.- Sumatoria SG y R-I multiplicado por el costo Promedio del código Costo OC+ Dev.- Sumatoria OC y Devoluciones multiplicado por el costo Promedio del código Costo Total SG.- Sumatoria Costo SG+R-I más Costo OC+ Dev Margen Real sin gastos 1er mes de Venta .- Margen real del código del primer mes de venta Margen Real Sin Gastos .- Se obtiene de (Venta Pesos - Costo Total) / Venta Pesos Margen Real Con Gastos .- Se obtiene de (Venta Pesos - Costo Total - Costo total SG) / Venta Pesos * reporte en 3 pestañas: Nivel Marca, Nivel proveedor y Nivel Sku.",https://trello.com/c/LuXkq1J9,2022-10-11 17:04:43,Done,615f3aba4b5e53331e333745,2022-10-21 14:12:19,Carlos Flores,carlosflores389,"GCIA Comercial Muebles (Ventas, Proveedores, eCommerce), Mkt, Exhibi.",2.638773148148148,87.23358796296297,3.240972222222222,,0.0017476851851851852,3.998784722222222,LuXkq1J9
ID 946pioSJ - Petición 37217.1 - Reporte de Clientes y Crédito,"Se solicita actualizar el reporte con el corte de Agosto de 2022 y la información del periodo del 2017. El reporte es para conocer el detalle de los clientes activos, así como linea disponible. Este informe en su mayoría ya se genera por parte de Alan Rodríguez Valenzuela de Control de Informes El folio de referencia del reporte anterior es de la petición 36470",https://trello.com/c/946pioSJ,2022-10-12 10:44:36,Done,615f3aba4b5e53331e333745,2022-10-20 08:00:56,Carlos Flores,carlosflores389,"GCIA Comercial Muebles (Ventas, Proveedores, eCommerce), Mkt, Exhibi.",0.0016666666666666668,88.49149305555555,6.793263888888888,,,1.091412037037037,946pioSJ
ID sEIYDH4T - Prueba cálculos de puntos y ranking en Evaluación Objetiva desde qlikview,Prueba cálculos de puntos y ranking en Evaluación Objetiva desde qlikview,https://trello.com/c/sEIYDH4T,2022-10-13 08:54:49,Done,615f3aba4b5e53331e333745,2022-10-21 09:02:59,Carlos Flores,carlosflores389,"GCIA Comercial Muebles (Ventas, Proveedores, eCommerce), Mkt, Exhibi.",0.0004513888888888889,87.44841435185185,,,,8.005219907407406,sEIYDH4T
ID BG0egAAW - Petición 37244.1 - Actualización de Catalogo de reporte de Agencias Coppel Motos,"Buen día,

Solicito su ayuda en actualizar el catalogo del reporte de ACM, con la intensión de agregar las 2 ACM nuevas en operación.

ACM:
-7940 San Pedro Pochutla
-7951 Pátzcuaro

Gracias!",https://trello.com/c/BG0egAAW,2022-10-17 15:06:29,Done,615f3aba4b5e53331e333745,2022-10-21 09:04:00,Carlos Flores,carlosflores389,"GCIA Comercial Muebles (Ventas, Proveedores, eCommerce), Mkt, Exhibi.",0.001990740740740741,87.44770833333332,,,,3.746284722222222,BG0egAAW
ID 2qzZYKWB - comportamiento por canales de las categorías de muebles - P10 2022,"Hola Carlos, buenas tardes. Espero te encuentres muy bien

El motivo de mi correo es solicitar tu apoyo con compartirme al corte del Periodo 10 los siguientes tableros del comportamiento por canales de las categorías de muebles, ya que se presentarán en el siguiente Comité de Estrategia de Categorías Omnicanales del 25 de octubre. 

Te agradecería me pudieras compartir la información a más tardar el jueves 20 de octubre. ",https://trello.com/c/2qzZYKWB,2022-10-18 12:30:39,Done,615f3aba4b5e53331e333745,2022-10-21 09:01:56,Carlos Flores,carlosflores389,"GCIA Comercial Muebles (Ventas, Proveedores, eCommerce), Mkt, Exhibi.",0.0001388888888888889,87.44914351851851,,,,2.854918981481481,2qzZYKWB
ID zQiqxajX - ID 2qzZYKWB -  Evaluación objetiva de marketplace - P10 2022,"De igual manera me gustaría solicitar tu apoyo actualizando la siguiente evaluación objetiva de marketplace al periodo 10 2022 por favor.

Te agradecería me pudieras compartir la información a más tardar el jueves 20 de octubre. ",https://trello.com/c/zQiqxajX,2022-10-18 12:32:05,Done,615f3aba4b5e53331e333745,2022-10-21 09:04:31,Carlos Flores,carlosflores389,"GCIA Comercial Muebles (Ventas, Proveedores, eCommerce), Mkt, Exhibi.",,87.44734953703704,2.8463541666666665,,,0.00949074074074074,zQiqxajX
ID fozTRIix - Reporte de Márgenes T&M,"Un reporte de márgenes para la categoría completa de Transporte y Movilidad del año natural;
en el que se pueda ver en los siguientes niveles la misma información del reporte en 3
pestañas: Nivel Marca, Nivel proveedor y Nivel Sku.    --- reporte ya generado ahora se solicita que se añada el Descuento Reconstruible, Margen Reconstruido y Margen Reconstruido con gastos ",https://trello.com/c/fozTRIix,2022-10-21 12:45:00,Done,6352bedf2d861902b5da4473,2022-10-25 17:11:39,Elizabeth Zuñiga Noriega,elizabethzuniganoriega,"GCIA Comercial Muebles (Ventas, Proveedores, eCommerce), Mkt, Exhibi.",0.16291666666666665,83.10906250000001,4.007372685185185,,,0.014884259259259259,fozTRIix
Replica de estructura de Febrero 2022 a Septiembre de 2022,"Se requiere la réplica de la estructura de la sección 108 Cartera Omnicanal (antes Sistemas Carteras) del mes de Febrero 2022 para el corte de Septiembre 2022. Esto se debe, a que en abril se modificó la estructura del área agregando el nivel jerárquico de Gerente Senior; sin embargo, este cambio no se trabajo hacia las lógicas de los indicadores que genera Control de Informes. Por lo cual, de no hacer la réplica de la estructura de Febrero 2022 a Septiembre 2022 los indicadores de la Evaluación Objetiva de la Gerencia Nacional y del Tablero de División Sistemas no se generarán y no se podrá realizar rendiciones de cuentas con Dirección.",https://trello.com/c/CXsGCmMX,2022-08-25 16:24:46,Done,,2022-10-11 16:48:09,,,GCIA Sistemas,5.1972453703703705,97.12530092592591,7.317534722222223,0.0018287037037037037,8.101851851851852e-05,0.7030902777777778,CXsGCmMX
Considerar secciones en EO Agosto Sistemas Prog,"Se solicita considerar las siguientes secciones para la generación de evaluaciones objetivas del mes de agosto en Sistemas Prog.
Debido a cambios en estructuras y nuevas secciones que se agregaron. Se anexa archivo con el detalle de las secciones y subsecciones.",https://trello.com/c/5W7tq6mD,2022-08-31 18:01:59,Done,58755a8a4d8e4aa29d8b4a13,2022-10-11 16:48:07,Yocely Delgado,yocely,GCIA Sistemas,12.751909722222223,97.12533564814815,5.315833333333333,8.867199074074074,4.3119907407407405,9.701770833333333,5W7tq6mD
Apagar el Indicador de Matrices de Seguimiento (Sistemas IT),"Es necesario que se apague el indicador ""Matriz de Seguimiento"" de las secciones 240 SISTEMAS IT II y 24-SISTEMAS IT I, para la Evaluación Objetiva del mes de Septiembre. ",https://trello.com/c/f4oo44ef,2022-09-22 17:57:58,Done,576bf6b4bc3ff8c3dc0b25bf,2022-10-07 10:17:44,Dania Kristel Osuna Contreras,daniaosuna,GCIA Sistemas,3.912962962962963,101.39645833333333,1.0514814814814815,0.0002777777777777778,7.722418981481481,1.993252314814815,f4oo44ef
Apagar el Indicador de Matrices de Seguimiento (Infraestructura-Central),"Es necesario que se apague el indicador ""Matriz de Seguimiento"" de las secciones 106-SIST TECNOLOGÍA GC, 233 PROYECTO TECNOLOGIA, 236 SERVICIO INFRAESTRUCTURA IT y 238 SERVICIOS MULTICLOUD para la Evaluación Objetiva del mes de Septiembre.",https://trello.com/c/wJfgZcHG,2022-09-22 18:03:08,Done,576bf6b4bc3ff8c3dc0b25bf,2022-10-07 10:17:46,Dania Kristel Osuna Contreras,daniaosuna,GCIA Sistemas,3.9093518518518517,101.39643518518518,1.0449421296296297,0.0002777777777777778,7.722465277777778,1.9997916666666666,wJfgZcHG
ID bs1h0cG7 - Replicar jerarquía,Es necesario que se replique la jerarquía del mes de Agosto para la Evaluación Objetiva de la División de Tecnología.,https://trello.com/c/bs1h0cG7,2022-10-03 11:46:17,Done,576bf6b4bc3ff8c3dc0b25bf,2022-10-11 16:48:11,Dania Kristel Osuna Contreras,daniaosuna,GCIA Sistemas,0.18650462962962963,97.12532407407407,7.318726851851852,0.0023958333333333336,0.0001273148148148148,0.7018981481481482,bs1h0cG7
ID oI8acNBK - Realizar reporte con detalle de resultados de Agosto y Septiembre de indicador Calidad en Producción.,"Favor de realizar reporte del mes de agosto y septiembre del el indicador de Calidad en Producción, esto con el proposito de cotejar resultados.

",https://trello.com/c/oI8acNBK,2022-10-07 17:54:43,Done,5ff5e745e855b16ef0fc2a40,2022-10-24 08:02:16,Thania Alejandra Arredondo Rocha,thaniaalejandraarredondorocha,GCIA Sistemas,2.901412037037037,84.49056712962964,6.942951388888889,0.001712962962962963,0.026412037037037036,6.716087962962963,oI8acNBK
Modelo de Gastos por Concepto - Reconexión al Datamart Contable,Modificar los sp existentes del modelo de gastos para reemplazar dentro de el las fuentes del stage por las nuevas del datamart.,https://trello.com/c/vfMz5sVm,2022-08-18 10:22:19,Done,61b649de354cf05e929f1b08,2022-10-14 16:11:27,leopoldo.zuniga,leopoldozuniga2,"GCIA Administración, Gastos, Legal, Compras internas",,94.15078703703703,7.306631944444444,,13.936828703703704,35.99899305555556,vfMz5sVm
Crear Informes de Aviso de Privacidad de Afore,"Buenos días Ricardo, un gusto saludarte.

Es de nuestro interés solicitar la generación de dos reportes (para visualizar en power BI report server), que nos muestre los afiliados Afore que aceptan el Aviso de Privacidad en los siguientes orígenes:
- Registro de afiliación
- Menú Afore
- App Afore Móvil

Lo ideal es que sean semejantes a los dos reportes que ya tenemos para Coppel, adjunto imágenes: (para estos nos apoyó Wilfredo García)

Licitación: Ricardo, Grace, Adolfo y Bastidas. 
********************* CLIENTES CON AVISO DE PRIVACIDAD ACEPTADOS *********************

Consideraciones: 
1er etapa. Trabajar en el Conteo (Tablas para la APP que se usan en el RPT producción Afore).
2da etapa. Detalle - Trazabilidad (QV).
3er etapa. GI y Analitica: Del total de afiliados / conteo con AP. (Proyecto con Procesar).

Acuerdo: En la APP se consideran los siguientes procesos siguientes como aceptación del AP:
1. Registro
2. Traspaso
3. Autovinculación

* Registros y traspasos por aforeMovil, todos estarian aceptados y se mostrarian.
* Registros y traspasos es obligatorio, porque concluyo el proceso. QV nos dice la fecha en la que termino el proceso y con procesar se puede obtener mas detalle de información. 
* Modificación de datos movil... no es obligatorio el AP, no se debe contabilizar.

Transparente el que se aplique aforeWeb (Registro,traspaso), mismos origenes de datos para los conteos. 

Proceso para registrar la petición ante procesar, Adolfo da seguimiento a la solicitud: 
1. Lanzar solicitud aprocesar
2. procesar proyectos 
3. propuesta economica
4. comite de priorización de proyectos
5. Fecha estimada

1. Mayo comite
2. Junio propuesta
3. Julio Aceptación como proyecto

https://drive.google.com/file/d/1dMWsP82XxL3W8fqMnyYGXhaAth_NhhD_/view?usp=sharing

------------------- Solicitud Grace por correo ------------------------------------
Es de nuestro interés solicitar la generación de dos reportes (para visualizar en power BI report server), que nos muestre los afiliados Afore que aceptan el Aviso de Privacidad en los siguientes orígenes:
- Registro de afiliación
- Menú Afore
- App Afore Móvil

Lo ideal es que sean semejantes a los dos reportes que ya tenemos para Coppel, adjunto imágenes: (para estos nos apoyó Wilfredo García)

Reporte 1- Detallado de clientes que aceptaron el Aviso
image.png

Reporte 2- Porcentaje de avance de aceptación
image.png",https://trello.com/c/FXzauHqT,2022-08-25 11:45:29,Done,61b649de354cf05e929f1b08,2022-10-06 08:00:53,leopoldo.zuniga,leopoldozuniga2,"GCIA Administración, Gastos, Legal, Compras internas",26.973530092592593,102.49145833333334,6.960648148148149,,,7.9098495370370365,FXzauHqT
Migración de data a base de datos DireccionFinanzas,Migración de los diferentes fuentes de información de la BD Indicador a nuestra BD DireccionFinanzas,https://trello.com/c/OfhdoxRW,2022-09-27 15:35:57,Done,61b649de354cf05e929f1b08,2022-10-14 16:05:30,leopoldo.zuniga,leopoldozuniga2,"GCIA Administración, Gastos, Legal, Compras internas",,94.15496527777778,6.983206018518519,8.71962962962963,0.0012152777777777778,1.3164699074074073,OfhdoxRW
ID oSCcSKNG - Folio APS 37078	ACTUALIZACION DE INFORME GENERAL DE TIENDAS,,https://trello.com/c/oSCcSKNG,2022-10-05 15:37:48,Done,61b649de354cf05e929f1b08,2022-10-25 09:12:25,leopoldo.zuniga,leopoldozuniga2,"GCIA Administración, Gastos, Legal, Compras internas",19.732372685185183,83.44184027777779,,,,,oSCcSKNG
ID IxdhGZv2 - Folio APS 36928	Mejora a información general de tiendas,,https://trello.com/c/IxdhGZv2,2022-10-05 15:38:37,Done,61b649de354cf05e929f1b08,2022-10-25 09:12:31,leopoldo.zuniga,leopoldozuniga2,"GCIA Administración, Gastos, Legal, Compras internas",19.731875,83.44177083333334,,,,,IxdhGZv2
ID USR4EcmB - Folio APS 36541 ORACLE - QV_Margen_EficienciaBonificacionIntCP,,https://trello.com/c/USR4EcmB,2022-10-05 15:39:22,Done,61b649de354cf05e929f1b08,2022-10-25 09:12:37,leopoldo.zuniga,leopoldozuniga2,"GCIA Administración, Gastos, Legal, Compras internas",19.73142361111111,83.44170138888889,,,,,USR4EcmB
ID 5Eha4bfX - Folio APS #36146	Llenado de Activos Analíticos Fuentes Ventas - QV,,https://trello.com/c/5Eha4bfX,2022-10-05 16:10:16,Done,61b649de354cf05e929f1b08,2022-10-25 09:12:43,leopoldo.zuniga,leopoldozuniga2,"GCIA Administración, Gastos, Legal, Compras internas",19.710034722222222,83.44163194444444,,,,,5Eha4bfX
ID IFEvOSWb - Folio APS #35475	Reporte Compras Administración de Obras,,https://trello.com/c/IFEvOSWb,2022-10-05 16:10:45,Done,61b649de354cf05e929f1b08,2022-10-25 09:12:48,leopoldo.zuniga,leopoldozuniga2,"GCIA Administración, Gastos, Legal, Compras internas",19.70974537037037,83.44157407407407,,,,,IFEvOSWb
ID oEmrEV36 - Folio APS #36265	Restructurar tabla CONTROLINFORMES.ADMIN.CAT_M2TIENDA,,https://trello.com/c/oEmrEV36,2022-10-05 16:11:17,Done,61b649de354cf05e929f1b08,2022-10-25 09:12:52,leopoldo.zuniga,leopoldozuniga2,"GCIA Administración, Gastos, Legal, Compras internas",19.709432870370367,83.44152777777778,,,,,oEmrEV36
ID vZ8t0Tre - Corrección en Reportes de Herramienta de seguimiento,,https://trello.com/c/vZ8t0Tre,2022-10-07 12:03:32,Done,61b649de354cf05e929f1b08,2022-10-11 08:38:14,leopoldo.zuniga,leopoldozuniga2,"GCIA Administración, Gastos, Legal, Compras internas",,97.46557870370368,0.0002199074074074074,,3.8572106481481483,,vZ8t0Tre
APS: 34485 - STATUS DE ENTREGA DE MOBILIARIO DE EXHIBICION PARA TIENDAS NUEVAS Y REMODELACIONES,,https://trello.com/c/neWE1O0m,2022-10-12 11:02:21,Done,6299460350e58b443a62d7ce,2022-10-13 08:35:08,Armando Beltran Medina,armandobeltran6,"GCIA Administración, Gastos, Legal, Compras internas",,95.46774305555554,,,0.8977662037037036,,neWE1O0m
ID X09TUKC0 - Revisar y validar el Costo de entrega al cliente por servicio liquidado (Anual Móvil y mensual),Indicador,https://trello.com/c/X09TUKC0,2022-08-03 13:56:26,Product Backlog,61b649de354cf05e929f1b08,2022-10-13 08:35:56,leopoldo.zuniga,leopoldozuniga2,"GCIA Administración, Gastos, Legal, Compras internas",47.11251157407407,14.36175925925926,,14.67837962962963,81.10533564814814,8.986539351851851,X09TUKC0
36694.1- Reporte Mensual de Planta Sale Vale - Savapre,"Se necesita por parte del negocio contar con un reporte mensual de la planta activa al corte de cada mes de los colboradores activos y cierta informacion detallada.

Empresa
# Colaborador
Nombre Colaborador
Fecha de Nacimiento Colaborador
Genero
Estado Civil
Ultimo nivel de estudios registrado
# Puesto
Nombre Puesto
Fecha Ingreso Grupo
Fecha Ingreso Puesto
# Centro
Nombre Centro
Ciudad
Región
Antiguedad Puesto actual meses
# Región
# Sección
Seccion
# Gerente del Centro
Gerente del Centro
# Puesto Gerente del Centro
Puesto Gerente del Centro
Fecha corte",https://trello.com/c/kRVWEtrn,2022-08-10 20:03:36,Done,5d02dfb4dbfd7270cd577891,2022-10-03 09:27:01,Maria Magdalena Gutierrez Armenta,mariamagdalenagutierrezarmenta,GCIA RRHH,25.74,105.43162037037037,6.880601851851853,6.788333333333334,9.11565972222222,5.033333333333333,kRVWEtrn
Reporte Mensual de puestos Estratégicos,"Se solicita el acceso a un reporte de manera mensual donde indique qué personas tienen el puesto de C- Level, Directores y Divisionales en todo Grupo Coppel, esto es para dar seguimiento a los beneficios que gozan estos puestos ya que hasta el momento no se tiene manera de saber cuando alguien asciende a uno de estos niveles y  por lo tanto no se le informa de los beneficios a los que tienen acceso. ",https://trello.com/c/Rx0MUvgn,2022-08-24 08:11:14,Done,62fd75cc31ed000d1a0be4da,2022-10-11 16:42:24,Jennifer Rivas Salazar,jenniferrivassalazar,GCIA RRHH,33.03315972222222,97.12929398148147,7.294803240740741,0.0003125,7.339803240740742,0.6868981481481482,Rx0MUvgn
REPORTE DE ALTAS ANUAL MOVIL,"Se requiere contar con un reporte con corte mensual de la informacion de las altas Anual movil con los siguientes datos:
- Empresa
- Area
- Tipo Area
- # Región Recursos Humanos
- Región Recursos Humanos
- # Región Cobranza
- Región Cobranza
- # Región Tienda
- Región Tienda
- # Sección
- Sección
- # Puesto
- Puesto
- Altas Anual Movil

Debe de omitirse a los empleados no validos (99)
Incluir los siguientes filtros dentro del reporte:  Empresa, Sección, Puesto
",https://trello.com/c/YEjas3jq,2022-08-25 16:25:14,Done,,2022-10-12 18:26:49,,,GCIA RRHH,25.66747685185185,96.05678240740741,2.2640625,0.0001388888888888889,7.339803240740742,6.790115740740741,YEjas3jq
"Incluir en el Modelo de Tableau la causa de baja""trabajo remoto""","Esta relacionada con la tarjeta : Integrar causa de baja a Repositorio de Información de Juntas de Dirección y/o Comités.

Se requiere que en el modelo de tableau de Recursos humanos en donde se pintan las causas de rotación se incluya en la visualizacion el nuevo motivo de baja ""Trabajo Remoto""
",https://trello.com/c/M6tEELpu,2022-09-07 18:33:12,Done,5d02dfb4dbfd7270cd577891,2022-10-03 09:27:25,Maria Magdalena Gutierrez Armenta,mariamagdalenagutierrezarmenta,GCIA RRHH,13.634953703703703,105.43138888888889,4.038773148148148,0.0004050925925925926,5.01650462962963,2.930347222222222,M6tEELpu
Actualizar repositorio Información Indicadores JDD - Comite DO con resultados del mes de Septiembre.,Actualizar el repositorio de Información Indicadores JDD - Comité DO con resultados al corte del mes de Septiembre del 2022.,https://trello.com/c/nz1iTehE,2022-10-05 08:49:09,Done,62f517c88139162f95eca4f1,2022-10-11 16:43:04,Adilene Anaid Rodriguez Uriarte,adileneanaidrodriguezuriarte,GCIA RRHH,1.0199189814814815,97.12888888888888,4.023472222222222,6.944444444444444e-05,0.006261574074074075,1.279386574074074,nz1iTehE
ID FI6meo3p - Solicitud información Rotación anual móvil,"De parte de Gobierno de incentivos solicitamos su apoyo para completar el archivo adjunto a la solicitud considerando la rotación anual móvil, mes actual y 11 anteriores de los puestos y sección indicados en el archivo.

La solicitud es en base al proyecto de Gobierno de Incentivos, a usarse para los análisis de la situación actual. ",https://trello.com/c/FI6meo3p,2022-10-05 13:14:19,Done,630f761f937348033838e5a2,2022-10-17 11:16:50,Jorge Adrian Arocha Enzastiga,jorgeadrianarochaenzastiga,GCIA RRHH,4.874780092592593,91.35543981481482,0.009375,0.0020949074074074073,3.071875,3.956157407407407,FI6meo3p
